actor_1_name,actor_2_name,actor_3_name,director_name,genres,movie_title,comb
William Schallert,Tisha Campbell-Martin,Helen Martin,George Jackson,Comedy|Drama|Music|Romance,house party,William Schallert Tisha Campbell-Martin Helen Martin George Jackson Comedy|Drama|Music|Romance
Tony Bonner,Jack Thompson,Tom Burlinson,George Miller,Adventure|Drama|Family|Romance|Western,the man from snowy riv,Tony Bonner Jack Thompson Tom Burlinson George Miller Adventure|Drama|Family|Romance|Western
Frank Welker,Constance Shulman,Alice Playten,Maurice Joyce,Animation|Comedy|Family,doug's 1st mov,Frank Welker Constance Shulman Alice Playten Maurice Joyce Animation|Comedy|Family
John Beasley,Todd Allen,June Carter Cash,Robert Duvall,Drama,the apost,John Beasley Todd Allen June Carter Cash Robert Duvall Drama
Faye Dunaway,Xander Berkeley,Diana Scarwid,Frank Perry,Biography|Drama,mommie deare,Faye Dunaway Xander Berkeley Diana Scarwid Frank Perry Biography|Drama
Zooey Deschanel,Adam Scott,Steve Coogan,Jesse Peretz,Comedy|Drama,our idiot broth,Zooey Deschanel Adam Scott Steve Coogan Jesse Peretz Comedy|Drama
William Hurt,Tony Curran,David Kross,Stephen Hopkins,Biography|Drama|Sport,ra,William Hurt Tony Curran David Kross Stephen Hopkins Biography|Drama|Sport
Bernie Mac,Monica Calhoun,Chrystale Wilson,Ice Cube,Comedy|Drama,the players cl,Bernie Mac Monica Calhoun Chrystale Wilson Ice Cube Comedy|Drama
Mekhi Phifer,Andrew Keegan,John Heard,Tim Blake Nelson,Drama|Romance|Thriller,,Mekhi Phifer Andrew Keegan John Heard Tim Blake Nelson Drama|Romance|Thriller
Ben Feldman,Edwin Hodge,Perdita Weeks,John Erick Dowdle,Horror|Mystery|Thriller,"as above, so bel",Ben Feldman Edwin Hodge Perdita Weeks John Erick Dowdle Horror|Mystery|Thriller
Boris Kodjoe,Cameron Mills,Sharon Leal,Bille Woodruff,Drama|Thriller,addict,Boris Kodjoe Cameron Mills Sharon Leal Bille Woodruff Drama|Thriller
Jurnee Smollett-Bell,Lynn Whitfield,Diahann Carroll,Kasi Lemmons,Drama,eve's bay,Jurnee Smollett-Bell Lynn Whitfield Diahann Carroll Kasi Lemmons Drama
Kristen Stewart,Hunter Parrish,Seth Gilliam,Richard Glatzer,Drama,still ali,Kristen Stewart Hunter Parrish Seth Gilliam Richard Glatzer Drama
Gene Tierney,Peter Ustinov,Jean Simmons,Michael Curtiz,Drama|History,the egypti,Gene Tierney Peter Ustinov Jean Simmons Michael Curtiz Drama|History
Sylvester Stallone,Lindsay Wagner,Persis Khambatta,Bruce Malmuth,Action|Crime|Thriller,nighthaw,Sylvester Stallone Lindsay Wagner Persis Khambatta Bruce Malmuth Action|Crime|Thriller
Kane Hodder,Peter Mark Richman,Scott Reeves,Rob Hedden,Adventure|Horror,friday the 13th part viii: jason takes manhatt,Kane Hodder Peter Mark Richman Scott Reeves Rob Hedden Adventure|Horror
Nia Vardalos,Louis Mandylor,Lainie Kazan,Joel Zwick,Comedy|Family|Romance,my big fat greek weddi,Nia Vardalos Louis Mandylor Lainie Kazan Joel Zwick Comedy|Family|Romance
James Franco,Heather Morris,Rachel Korine,Harmony Korine,Crime|Drama,spring breake,James Franco Heather Morris Rachel Korine Harmony Korine Crime|Drama
Donald Pleasence,Kim Darby,Mitchell Ryan,Joe Chappelle,Horror|Thriller,halloween: the curse of michael mye,Donald Pleasence Kim Darby Mitchell Ryan Joe Chappelle Horror|Thriller
Maribel Verdú,Daniel Giménez Cacho,María Aura,Alfonso Cuarón,Adventure|Comedy|Drama|Romance,y tu mamá tambi,Maribel Verdú Daniel Giménez Cacho María Aura Alfonso Cuarón Adventure|Comedy|Drama|Romance
Peter Serafinowicz,Dylan Moran,Rafe Spall,Edgar Wright,Comedy|Horror,shaun of the de,Peter Serafinowicz Dylan Moran Rafe Spall Edgar Wright Comedy|Horror
Jessica Lowndes,Randy Wayne,Haley Bennett,Mickey Liddell,Drama|Horror|Thriller,the haunting of molly hartl,Jessica Lowndes Randy Wayne Haley Bennett Mickey Liddell Drama|Horror|Thriller
Matthew McConaughey,Clifton James,Miriam Colon,John Sayles,Drama|Mystery,lone st,Matthew McConaughey Clifton James Miriam Colon John Sayles Drama|Mystery
Donald Pleasence,Kathleen Kinmont,Ellie Cornell,Dwight H. Little,Horror|Thriller,halloween 4: the return of michael mye,Donald Pleasence Kathleen Kinmont Ellie Cornell Dwight H. Little Horror|Thriller
Thomas F. Wilson,Deborah Foreman,Clayton Rohner,Fred Walton,Horror|Mystery,april fool's d,Thomas F. Wilson Deborah Foreman Clayton Rohner Fred Walton Horror|Mystery
Steve Guttenberg,Daniel Stern,Ellen Barkin,Barry Levinson,Comedy|Drama,din,Steve Guttenberg Daniel Stern Ellen Barkin Barry Levinson Comedy|Drama
David Carradine,William Sanderson,Robert Beltran,Steve Carver,Action|Crime|Drama|Thriller|Western,lone wolf mcqua,David Carradine William Sanderson Robert Beltran Steve Carver Action|Crime|Drama|Thriller|Western
Warren Christie,Ryan Robbins,Andrew Airlie,Gonzalo López-Gallego,Horror|Mystery|Sci-Fi|Thriller,apollo ,Warren Christie Ryan Robbins Andrew Airlie Gonzalo López-Gallego Horror|Mystery|Sci-Fi|Thriller
Clifton Collins Jr.,Mary Lynn Rajskub,Paul Dooley,Christine Jeffs,Comedy|Drama,sunshine cleani,Clifton Collins Jr. Mary Lynn Rajskub Paul Dooley Christine Jeffs Comedy|Drama
Sterling Jerins,Claire Geare,Sahajak Boonthanakit,John Erick Dowdle,Action|Thriller,no esca,Sterling Jerins Claire Geare Sahajak Boonthanakit John Erick Dowdle Action|Thriller
Vanna Bonta,John Amos,Rip Torn,Don Coscarelli,Action|Adventure|Fantasy,the beastmast,Vanna Bonta John Amos Rip Torn Don Coscarelli Action|Adventure|Fantasy
Gina Lollobrigida,George Sanders,Finlay Currie,King Vidor,Drama|History|Romance|War,solomon and she,Gina Lollobrigida George Sanders Finlay Currie King Vidor Drama|History|Romance|War
Fred Willard,Mike Epps,Russell Peters,Michael Tiddes,Comedy,fifty shades of bla,Fred Willard Mike Epps Russell Peters Michael Tiddes Comedy
Eddie Cibrian,Jenifer Lewis,Wood Harris,Bill Duke,Drama|Romance,not easily brok,Eddie Cibrian Jenifer Lewis Wood Harris Bill Duke Drama|Romance
Gary Cooper,Helen Hayes,Adolphe Menjou,Frank Borzage,Drama|Romance|War,a farewell to ar,Gary Cooper Helen Hayes Adolphe Menjou Frank Borzage Drama|Romance|War
Donald Faison,Brandy Norwood,Lauren London,Bille Woodruff,Comedy|Romance,the perfect mat,Donald Faison Brandy Norwood Lauren London Bille Woodruff Comedy|Romance
Lara Jill Miller,Colleen O'Shaughnessey,Mona Marshall,Mamoru Hosoda,Action|Adventure|Animation|Family|Sci-Fi,digimon: the mov,Lara Jill Miller Colleen O'Shaughnessey Mona Marshall Mamoru Hosoda Action|Adventure|Animation|Family|Sci-Fi
Macaulay Culkin,Patrick Fugit,Eva Amurri Martino,Brian Dannelly,Comedy|Drama,save,Macaulay Culkin Patrick Fugit Eva Amurri Martino Brian Dannelly Comedy|Drama
Marie-Josée Croze,Stéphane Rousseau,Marina Hands,Denys Arcand,Comedy|Crime|Drama|Mystery|Romance,the barbarian invasio,Marie-Josée Croze Stéphane Rousseau Marina Hands Denys Arcand Comedy|Crime|Drama|Mystery|Romance
Robert Shaw,Denholm Elliott,Nicol Williamson,Richard Lester,Adventure|Drama|Romance,robin and mari,Robert Shaw Denholm Elliott Nicol Williamson Richard Lester Adventure|Drama|Romance
Brendan Fehr,Kerr Smith,Izabella Miko,J.S. Cardone,Horror|Thriller,the forsak,Brendan Fehr Kerr Smith Izabella Miko J.S. Cardone Horror|Thriller
Harrison Ford,Carl Weathers,Franco Nero,Guy Hamilton,Action|Drama|War,force 10 from navaro,Harrison Ford Carl Weathers Franco Nero Guy Hamilton Action|Drama|War
Fran Drescher,Gedde Watanabe,Michael Richards,Jay Levey,Comedy|Drama,u,Fran Drescher Gedde Watanabe Michael Richards Jay Levey Comedy|Drama
Linda Cardellini,Joel David Moore,Shirley Jones,Nicholaus Goossen,Comedy,grandma's b,Linda Cardellini Joel David Moore Shirley Jones Nicholaus Goossen Comedy
Natasha Lyonne,Kevin Corrigan,Jessica Walter,Tamara Jenkins,Comedy|Drama,slums of beverly hil,Natasha Lyonne Kevin Corrigan Jessica Walter Tamara Jenkins Comedy|Drama
Claudia Cardinale,Woody Strode,Jack Elam,Sergio Leone,Western,once upon a time in the we,Claudia Cardinale Woody Strode Jack Elam Sergio Leone Western
Jon Favreau,Faizon Love,Jonathan Silverman,Jon Favreau,Comedy|Crime|Drama|Thriller,ma,Jon Favreau Faizon Love Jonathan Silverman Jon Favreau Comedy|Crime|Drama|Thriller
Kevin Spacey,Matt Berry,Benedict Wong,Duncan Jones,Drama|Mystery|Sci-Fi,mo,Kevin Spacey Matt Berry Benedict Wong Duncan Jones Drama|Mystery|Sci-Fi
Miranda Cosgrove,Jami Gertz,Carter Jenkins,Scott Marshall,Comedy,keeping up with the stei,Miranda Cosgrove Jami Gertz Carter Jenkins Scott Marshall Comedy
Norbert Ferrer,Guillaume Denaiffe,Chloe Hollings,Ronan Chapalain,Documentary,sea rex 3d: journey to a prehistoric wor,Norbert Ferrer Guillaume Denaiffe Chloe Hollings Ronan Chapalain Documentary
Bruce Greenwood,Sarah Polley,Simon Baker,Atom Egoyan,Drama,the sweet hereaft,Bruce Greenwood Sarah Polley Simon Baker Atom Egoyan Drama
Lambert Wilson,Michael Lonsdale,Olivier Rabourdin,Xavier Beauvois,Drama,of gods and m,Lambert Wilson Michael Lonsdale Olivier Rabourdin Xavier Beauvois Drama
Alan Rickman,Freddy Rodríguez,Greg Collins,Randall Miller,Comedy|Drama,bottle sho,Alan Rickman Freddy Rodríguez Greg Collins Randall Miller Comedy|Drama
Cassandra Peterson,Tim Thomerson,Bess Armstrong,Jerry Belson,Comedy|Music|Sci-Fi,jekyll and hyde... together aga,Cassandra Peterson Tim Thomerson Bess Armstrong Jerry Belson Comedy|Music|Sci-Fi
Kate Winslet,Jed Brophy,Liz Mullane,Peter Jackson,Biography|Crime|Drama|Romance|Thriller,heavenly creatur,Kate Winslet Jed Brophy Liz Mullane Peter Jackson Biography|Crime|Drama|Romance|Thriller
Hayden Christensen,Bobby Batson,Cynthia Barrett,Michael Polish,Drama,90 minutes in heav,Hayden Christensen Bobby Batson Cynthia Barrett Michael Polish Drama
Will Ferrell,Scott Takeda,Stephen Root,Dan Rush,Comedy|Drama,everything must ,Will Ferrell Scott Takeda Stephen Root Dan Rush Comedy|Drama
Kim Dickens,Ryan O'Neal,Angela Featherstone,Jake Kasdan,Comedy|Crime|Drama|Mystery|Thriller,zero effe,Kim Dickens Ryan O'Neal Angela Featherstone Jake Kasdan Comedy|Crime|Drama|Mystery|Thriller
Christian Bale,Jennifer Jason Leigh,Reg E. Cathey,Brad Anderson,Drama|Thriller,the machini,Christian Bale Jennifer Jason Leigh Reg E. Cathey Brad Anderson Drama|Thriller
Dana Delany,Jane Adams,David Clennon,Paul Schrader,Crime|Drama,light sleep,Dana Delany Jane Adams David Clennon Paul Schrader Crime|Drama
Jeremy Renner,Paz Vega,Robert Pralgo,Michael Cuesta,Biography|Crime|Drama|Mystery|Thriller,kill the messeng,Jeremy Renner Paz Vega Robert Pralgo Michael Cuesta Biography|Crime|Drama|Mystery|Thriller
Dianne Wiest,Jon Tenney,Tammy Blanchard,John Cameron Mitchell,Drama,rabbit ho,Dianne Wiest Jon Tenney Tammy Blanchard John Cameron Mitchell Drama
Macaulay Culkin,Mia Kirshner,Marilyn Manson,Fenton Bailey,Biography|Crime|Drama|Thriller,party monst,Macaulay Culkin Mia Kirshner Marilyn Manson Fenton Bailey Biography|Crime|Drama|Thriller
Alia Shawkat,Mark Webber,Joe Cole,Jeremy Saulnier,Crime|Horror|Music|Thriller,green ro,Alia Shawkat Mark Webber Joe Cole Jeremy Saulnier Crime|Horror|Music|Thriller
Liza Minnelli,Tim Russ,Winter Ave Zoli,Billy Kent,Comedy|Drama|Romance,the oh in oh,Liza Minnelli Tim Russ Winter Ave Zoli Billy Kent Comedy|Drama|Romance
Joaquim de Almeida,Greg Germann,Kristoffer Polaha,James Manera,Drama|Mystery|Sci-Fi,atlas shrugged: who is john gal,Joaquim de Almeida Greg Germann Kristoffer Polaha James Manera Drama|Mystery|Sci-Fi
Andrew Wilson,Darryl Cox,Lumi Cavazos,Wes Anderson,Comedy|Crime|Drama,bottle rock,Andrew Wilson Darryl Cox Lumi Cavazos Wes Anderson Comedy|Crime|Drama
Viggo Mortensen,Joe Mantegna,Faye Dunaway,Kevin Spacey,Crime|Drama|Thriller,albino alligat,Viggo Mortensen Joe Mantegna Faye Dunaway Kevin Spacey Crime|Drama|Thriller
Akshaye Khanna,Bhoomika Chawla,Darshan Jariwala,Feroz Abbas Khan,Biography|Drama|History,"gandhi, my fath",Akshaye Khanna Bhoomika Chawla Darshan Jariwala Feroz Abbas Khan Biography|Drama|History
Jeffrey Frost,Megan Ambuhl Graner,Ken Davis,Errol Morris,Crime|Documentary|War,standard operating procedu,Jeffrey Frost Megan Ambuhl Graner Ken Davis Errol Morris Crime|Documentary|War
Raymond Burr,Don Gordon,Jim Byrnes,Dennis Hopper,Drama,out of the bl,Raymond Burr Don Gordon Jim Byrnes Dennis Hopper Drama
Katrina Bowden,Tyler Labine,Chelan Simmons,Eli Craig,Comedy|Horror,tucker and dale vs ev,Katrina Bowden Tyler Labine Chelan Simmons Eli Craig Comedy|Horror
Adam Scott,Ellen Burstyn,Martin Landau,Nicholas Fackler,Drama|Romance,"lovely, sti",Adam Scott Ellen Burstyn Martin Landau Nicholas Fackler Drama|Romance
Judith Anderson,Paul Fix,Laraine Day,Richard Wallace,Adventure|Drama|Romance,tyco,Judith Anderson Paul Fix Laraine Day Richard Wallace Adventure|Drama|Romance
Ethan Suplee,John Heard,Sara Gilbert,Morgan J. Freeman,Drama,desert bl,Ethan Suplee John Heard Sara Gilbert Morgan J. Freeman Drama
Meghan Ory,Marc Trottier,Corey Sevier,Matthew Hastings,Comedy|Horror|Sci-Fi,deco,Meghan Ory Marc Trottier Corey Sevier Matthew Hastings Comedy|Horror|Sci-Fi
Ocean James,Patch Darragh,Olivia DeJonge,M. Night Shyamalan,Horror|Thriller,the vis,Ocean James Patch Darragh Olivia DeJonge M. Night Shyamalan Horror|Thriller
Mike Figueroa,Daniel Stewart Sherman,Kel O'Neill,Brian De Palma,Crime|Thriller|War,redact,Mike Figueroa Daniel Stewart Sherman Kel O'Neill Brian De Palma Crime|Thriller|War
Adam Garcia,Jacqueline Bisset,Alice Evans,Klaus Menzel,Mystery|Romance|Thriller,fascinati,Adam Garcia Jacqueline Bisset Alice Evans Klaus Menzel Mystery|Romance|Thriller
Holly Hunter,Dylan Minnette,Bokeem Woodbine,uknown,Drama|Fantasy,saving grace          ,Holly Hunter Dylan Minnette Bokeem Woodbine uknown Drama|Fantasy
Glenn Campbell,Sandra Staggs,Jelena Nik,Oren Peli,Horror|Sci-Fi|Thriller,area ,Glenn Campbell Sandra Staggs Jelena Nik Oren Peli Horror|Sci-Fi|Thriller
Luis Tosar,Tony Corvillo,Marta Etura,Jaume Balagueró,Drama|Horror|Thriller,sleep tig,Luis Tosar Tony Corvillo Marta Etura Jaume Balagueró Drama|Horror|Thriller
Dave Legeno,Doug Bradley,Georgia Groome,Paul Andrew Williams,Comedy|Crime|Horror|Thriller,the cotta,Dave Legeno Doug Bradley Georgia Groome Paul Andrew Williams Comedy|Crime|Horror|Thriller
Henry Ian Cusick,Callum Blue,Shenae Grimes-Beech,Stephen Herek,Comedy|Drama|Fantasy,dead like me: life after dea,Henry Ian Cusick Callum Blue Shenae Grimes-Beech Stephen Herek Comedy|Drama|Fantasy
Alyson Hannigan,John Stamos,Jim Belushi,Bob Saget,Animation|Comedy,farce of the pengui,Alyson Hannigan John Stamos Jim Belushi Bob Saget Animation|Comedy
Heather Locklear,Patricia Neal,Katie Leclerc,Jim Amatulli,Drama|Family|Music,flying ,Heather Locklear Patricia Neal Katie Leclerc Jim Amatulli Drama|Family|Music
Corbin Bernsen,Dulé Hill,Timothy Omundson,uknown,Comedy|Crime|Mystery,psych          ,Corbin Bernsen Dulé Hill Timothy Omundson uknown Comedy|Crime|Mystery
Billy Crudup,Felicity Huffman,David Adam Flannery,William H. Macy,Comedy|Drama|Music,rudderle,Billy Crudup Felicity Huffman David Adam Flannery William H. Macy Comedy|Drama|Music
Chazz Palminteri,Cyndi Lauper,Danny Aiello,Barrett Esposito,Animation|Family,henry & ,Chazz Palminteri Cyndi Lauper Danny Aiello Barrett Esposito Animation|Family
Gary Cole,Jon Heder,Cheryl Hines,Mitch Davis,Comedy,christmas e,Gary Cole Jon Heder Cheryl Hines Mitch Davis Comedy
Teri Polo,Esai Morales,Nicholas Gonzalez,Eric Bross,Crime|Drama|Thriller,we have your husba,Teri Polo Esai Morales Nicholas Gonzalez Eric Bross Crime|Drama|Thriller
Nicolas Cage,Irène Jacob,Tomiwa Edun,Paul Schrader,Drama|Thriller,dying of the lig,Nicolas Cage Irène Jacob Tomiwa Edun Paul Schrader Drama|Thriller
James Frain,Sofia Black-D'Elia,Lisa Kay,Vicky Jewson,Action|Drama|Thriller|War,born of w,James Frain Sofia Black-D'Elia Lisa Kay Vicky Jewson Action|Drama|Thriller|War
David Huddleston,Sam Waterston,Hal Holbrook,Peter Hyams,Action|Sci-Fi|Thriller,capricorn o,David Huddleston Sam Waterston Hal Holbrook Peter Hyams Action|Sci-Fi|Thriller
Michael Rapaport,Natasha Henstridge,Costas Mandylor,Marc Bennett,Comedy|Drama,should've been rom,Michael Rapaport Natasha Henstridge Costas Mandylor Marc Bennett Comedy|Drama
David Raizor,Cody Howard,Martin Kove,Mike Mayhall,Family,running forev,David Raizor Cody Howard Martin Kove Mike Mayhall Family
Johnny Depp,Haley Joel Osment,Natasha Lyonne,Kevin Smith,Comedy|Fantasy|Horror|Thriller,yoga hose,Johnny Depp Haley Joel Osment Natasha Lyonne Kevin Smith Comedy|Fantasy|Horror|Thriller
Mikal Vega,Michael Dudikoff,Ed Quinn,Stanton Barrett,Action|Horror,navy seals vs. zombi,Mikal Vega Michael Dudikoff Ed Quinn Stanton Barrett Action|Horror
Julia Jentsch,Ivan Barnev,Milan Lasica,Jirí Menzel,Comedy|Drama|Romance|War,i served the king of engla,Julia Jentsch Ivan Barnev Milan Lasica Jirí Menzel Comedy|Drama|Romance|War
Udo Kier,Moritz Bleibtreu,Birol Ünel,Fatih Akin,Comedy|Drama,soul kitch,Udo Kier Moritz Bleibtreu Birol Ünel Fatih Akin Comedy|Drama
Robert Duvall,Dwight Yoakam,J.T. Walsh,Billy Bob Thornton,Drama,sling bla,Robert Duvall Dwight Yoakam J.T. Walsh Billy Bob Thornton Drama
Isaac Hempstead Wright,Imelda Staunton,Joseph Mawle,Nick Murphy,Horror|Thriller,the awakeni,Isaac Hempstead Wright Imelda Staunton Joseph Mawle Nick Murphy Horror|Thriller
Jay Hernandez,Takashi Miike,Rick Hoffman,Eli Roth,Horror,host,Jay Hernandez Takashi Miike Rick Hoffman Eli Roth Horror
Steve Coogan,Shirley Henderson,Dylan Moran,Michael Winterbottom,Comedy|Drama,tristram shandy: a cock and bull sto,Steve Coogan Shirley Henderson Dylan Moran Michael Winterbottom Comedy|Drama
Katy Mixon,Shea Whigham,Robert Longstreet,Jeff Nichols,Drama|Thriller,take shelt,Katy Mixon Shea Whigham Robert Longstreet Jeff Nichols Drama|Thriller
Alex Rocco,Lukas Haas,Katherine Helmond,Frank LaLoggia,Fantasy|Horror|Mystery|Thriller,lady in whi,Alex Rocco Lukas Haas Katherine Helmond Frank LaLoggia Fantasy|Horror|Mystery|Thriller
Rupert Grint,Julie Walters,Tamsin Egerton,Jeremy Brock,Comedy|Drama,driving lesso,Rupert Grint Julie Walters Tamsin Egerton Jeremy Brock Comedy|Drama
Donald Faison,Greg Grunberg,Dagmara Dominczyk,Scott Foley,Comedy|Crime,let's kill ward's wi,Donald Faison Greg Grunberg Dagmara Dominczyk Scott Foley Comedy|Crime
Bill Johnson,Lou Perryman,Jim Siedow,Tobe Hooper,Comedy|Horror,the texas chainsaw massacre,Bill Johnson Lou Perryman Jim Siedow Tobe Hooper Comedy|Horror
James Coburn,Bob Dylan,Jason Robards,Sam Peckinpah,Biography|Drama|Romance|Western,pat garrett & billy the k,James Coburn Bob Dylan Jason Robards Sam Peckinpah Biography|Drama|Romance|Western
Ryan Gosling,Kristin Scott Thomas,Yayaying Rhatha Phongam,Nicolas Winding Refn,Crime|Drama,only god forgiv,Ryan Gosling Kristin Scott Thomas Yayaying Rhatha Phongam Nicolas Winding Refn Crime|Drama
Denis Lavant,Isild Le Besco,Emmanuelle Bercot,Christophe Ali,Drama,camping sauva,Denis Lavant Isild Le Besco Emmanuelle Bercot Christophe Ali Drama
Maria Conchita Alonso,Kate del Castillo,Camryn Manheim,Gabriela Tagliavini,Comedy,without m,Maria Conchita Alonso Kate del Castillo Camryn Manheim Gabriela Tagliavini Comedy
Bhama,Diganth,Dileep Raj,Shekar,Comedy|Romance,bar,Bhama Diganth Dileep Raj Shekar Comedy|Romance
Gerard Butler,Sharon Small,Jack McElhone,Shona Auerbach,Drama|Romance,dear frank,Gerard Butler Sharon Small Jack McElhone Shona Auerbach Drama|Romance
Keith Carradine,Gary Farmer,Stephen McHattie,Leonard Farlinger,Western,all h,Keith Carradine Gary Farmer Stephen McHattie Leonard Farlinger Western
Sara Forestier,Jacques Gamblin,Zinedine Soualem,Michel Leclerc,Comedy|Drama|Romance,the names of lo,Sara Forestier Jacques Gamblin Zinedine Soualem Michel Leclerc Comedy|Drama|Romance
Zoë Kravitz,Douglas Smith,Kim Ly,Analeine Cal y Mayor,Comedy|Drama,treading wat,Zoë Kravitz Douglas Smith Kim Ly Analeine Cal y Mayor Comedy|Drama
Eddie Redmayne,Elena Anaya,Stephen Dillane,Tom Kalin,Drama,savage gra,Eddie Redmayne Elena Anaya Stephen Dillane Tom Kalin Drama
William Kircher,Matthew Sunderland,Paul Glover,Robert Sarkies,Crime|Drama,out of the bl,William Kircher Matthew Sunderland Paul Glover Robert Sarkies Crime|Drama
Steve Guttenberg,Bubba Smith,Michael Winslow,Hugh Wilson,Comedy,police acade,Steve Guttenberg Bubba Smith Michael Winslow Hugh Wilson Comedy
Brooke Shields,Christopher Atkins,Leo McKern,Randal Kleiser,Adventure|Drama|Romance,the blue lago,Brooke Shields Christopher Atkins Leo McKern Randal Kleiser Adventure|Drama|Romance
Kristin Scott Thomas,James Fleet,Simon Callow,Mike Newell,Comedy|Drama|Romance,four weddings and a funer,Kristin Scott Thomas James Fleet Simon Callow Mike Newell Comedy|Drama|Romance
Jennifer Jason Leigh,Judge Reinhold,Vincent Schiavelli,Amy Heckerling,Comedy|Drama,fast times at ridgemont hi,Jennifer Jason Leigh Judge Reinhold Vincent Schiavelli Amy Heckerling Comedy|Drama
Royal Dano,Richard Basehart,James Robertson Justice,John Huston,Adventure|Drama,moby di,Royal Dano Richard Basehart James Robertson Justice John Huston Adventure|Drama
Philip Seymour Hoffman,Rosario Dawson,Aaron Stanford,Spike Lee,Drama,25th ho,Philip Seymour Hoffman Rosario Dawson Aaron Stanford Spike Lee Drama
Dan Fogler,Indiana Evans,KaDee Strickland,uknown,Crime|Drama,secrets and lies          ,Dan Fogler Indiana Evans KaDee Strickland uknown Crime|Drama
Christopher Meloni,Kevin Michael Richardson,Peter Spellos,Lana Wachowski,Crime|Drama|Romance|Thriller,bou,Christopher Meloni Kevin Michael Richardson Peter Spellos Lana Wachowski Crime|Drama|Romance|Thriller
Ellen Burstyn,Mark Margolis,Louise Lasser,Darren Aronofsky,Drama,requiem for a dre,Ellen Burstyn Mark Margolis Louise Lasser Darren Aronofsky Drama
Dana Andrews,Jeanne Crain,Frank McHugh,Walter Lang,Musical|Romance,state fa,Dana Andrews Jeanne Crain Frank McHugh Walter Lang Musical|Romance
Mía Maestro,Juan Luis Galiardo,Miguel Ángel Solá,Carlos Saura,Drama|Musical,tan,Mía Maestro Juan Luis Galiardo Miguel Ángel Solá Carlos Saura Drama|Musical
Jim Belushi,John Savage,Juan Fernández,Oliver Stone,Drama|History|Thriller|War,salvad,Jim Belushi John Savage Juan Fernández Oliver Stone Drama|History|Thriller|War
Alex Kendrick,Sarah Drew,Patricia Heaton,Andrew Erwin,Comedy,moms' night o,Alex Kendrick Sarah Drew Patricia Heaton Andrew Erwin Comedy
Jake Gyllenhaal,Mary McDonnell,James Duval,Richard Kelly,Drama|Sci-Fi|Thriller,donnie dar,Jake Gyllenhaal Mary McDonnell James Duval Richard Kelly Drama|Sci-Fi|Thriller
Jaime Camil,Gerardo Taracena,Joaquín Cosio,Beto Gómez,Adventure|Comedy|Western,saving private per,Jaime Camil Gerardo Taracena Joaquín Cosio Beto Gómez Adventure|Comedy|Western
Jan Decleir,Fedja van Huêt,Hans Kesting,Mike van Diem,Crime|Drama|Mystery,charact,Jan Decleir Fedja van Huêt Hans Kesting Mike van Diem Crime|Drama|Mystery
Patrick Fugit,Nicholas Gonzalez,Debbie Harry,Jonas Åkerlund,Comedy|Crime|Drama,sp,Patrick Fugit Nicholas Gonzalez Debbie Harry Jonas Åkerlund Comedy|Crime|Drama
Rich Pecci,Shirley Henderson,Charlotte Rampling,Todd Solondz,Comedy|Drama,life during warti,Rich Pecci Shirley Henderson Charlotte Rampling Todd Solondz Comedy|Drama
Min-sik Choi,Yeong-ae Lee,Hye-jeong Kang,Chan-wook Park,Crime|Drama,lady vengean,Min-sik Choi Yeong-ae Lee Hye-jeong Kang Chan-wook Park Crime|Drama
Nicolas Giraud,Clovis Fouin,Marie Féret,René Féret,Biography|Drama|Music|Romance,mozart's sist,Nicolas Giraud Clovis Fouin Marie Féret René Féret Biography|Drama|Music|Romance
Jason Statham,Jason Flemyng,Danny Dyer,Barry Skolnick,Comedy|Drama|Sport,mean machi,Jason Statham Jason Flemyng Danny Dyer Barry Skolnick Comedy|Drama|Sport
Simon Yam,Anthony Chau-Sang Wong,Josie Ho,Johnnie To,Action|Crime|Thriller,exil,Simon Yam Anthony Chau-Sang Wong Josie Ho Johnnie To Action|Crime|Thriller
Sam Shepard,Dominique McElligott,Stephen Rea,Mateo Gil,Action|Adventure|Western,blacktho,Sam Shepard Dominique McElligott Stephen Rea Mateo Gil Action|Adventure|Western
Oksana Akinshina,Artyom Bogucharskiy,Lyubov Agapova,Lukas Moodysson,Crime|Drama,lilya 4-ev,Oksana Akinshina Artyom Bogucharskiy Lyubov Agapova Lukas Moodysson Crime|Drama
Liam Neeson,Josh Charles,Chandler Canterbury,Agnieszka Wojtowicz-Vosloo,Drama|Horror|Mystery|Thriller,after.li,Liam Neeson Josh Charles Chandler Canterbury Agnieszka Wojtowicz-Vosloo Drama|Horror|Mystery|Thriller
Jimmy Shergill,Sana Saeed,Dimple Kapadia,Kabir Sadanand,Drama|Thriller,fug,Jimmy Shergill Sana Saeed Dimple Kapadia Kabir Sadanand Drama|Thriller
Scatman Crothers,Michael Berryman,Louise Fletcher,Milos Forman,Drama,one flew over the cuckoo's ne,Scatman Crothers Michael Berryman Louise Fletcher Milos Forman Drama
Katherine McNamara,Dove Cameron,Braeden Lemasters,Peter DeLuise,Comedy,r.l. stine's monsterville: the cabinet of sou,Katherine McNamara Dove Cameron Braeden Lemasters Peter DeLuise Comedy
Sid Caesar,Dom DeLuise,Bernadette Peters,Mel Brooks,Comedy|Romance,silent mov,Sid Caesar Dom DeLuise Bernadette Peters Mel Brooks Comedy|Romance
Nimrat Kaur,Sameer Ali Khan,Purab Kohli,Raja Menon,Action|Drama|History|Thriller|War,airli,Nimrat Kaur Sameer Ali Khan Purab Kohli Raja Menon Action|Drama|History|Thriller|War
Zack Ward,Jonathan Crombie,Megan Follows,uknown,Drama|Family,anne of green gables          ,Zack Ward Jonathan Crombie Megan Follows uknown Drama|Family
Michael Jai White,Michael J. Morris,Lateef Crowder,Ernie Barbarash,Action|Adventure,falcon risi,Michael Jai White Michael J. Morris Lateef Crowder Ernie Barbarash Action|Adventure
Hayley Atwell,Ray Winstone,Alan Ford,Nick Love,Action|Crime|Drama,the sween,Hayley Atwell Ray Winstone Alan Ford Nick Love Action|Crime|Drama
Ray Winstone,James Fox,Amanda Redman,Jonathan Glazer,Crime|Thriller,sexy bea,Ray Winstone James Fox Amanda Redman Jonathan Glazer Crime|Thriller
Fabian Bolin,Fares Fares,Matias Varela,Daniel Espinosa,Action|Crime|Drama|Thriller,easy mon,Fabian Bolin Fares Fares Matias Varela Daniel Espinosa Action|Crime|Drama|Thriller
Keisha Castle-Hughes,Rawiri Paratene,Tammy Davis,Niki Caro,Drama|Family,whale rid,Keisha Castle-Hughes Rawiri Paratene Tammy Davis Niki Caro Drama|Family
