actor_1_name,actor_2_name,actor_3_name,director_name,genres,movie_title,comb
Robert De Niro,Brad Pitt,Minnie Driver,Barry Levinson,Crime|Drama|Thriller,sleepe,Robert De Niro Brad Pitt Minnie Driver Barry Levinson Crime|Drama|Thriller
Sylvester Stallone,Julia Nickson,Martin Kove,George P. Cosmatos,Action|Adventure|Thriller|War,rambo: first blood part ,Sylvester Stallone Julia Nickson Martin Kove George P. Cosmatos Action|Adventure|Thriller|War
Joseph Gordon-Levitt,Demi Moore,Anne Heche,Brian Gibson,Drama|Thriller,the jur,Joseph Gordon-Levitt Demi Moore Anne Heche Brian Gibson Drama|Thriller
Mel Blanc,Dickie Jones,Cliff Edwards,Norman Ferguson,Animation|Family|Fantasy|Musical,pinocch,Mel Blanc Dickie Jones Cliff Edwards Norman Ferguson Animation|Family|Fantasy|Musical
Jeff Bridges,Sam Waterston,Isabelle Huppert,Michael Cimino,Adventure|Drama|Western,heaven's ga,Jeff Bridges Sam Waterston Isabelle Huppert Michael Cimino Adventure|Drama|Western
Sophia Myles,Tony Curran,Derek Jacobi,Len Wiseman,Action|Adventure|Fantasy|Sci-Fi|Thriller,underworld: evoluti,Sophia Myles Tony Curran Derek Jacobi Len Wiseman Action|Adventure|Fantasy|Sci-Fi|Thriller
Daniel Radcliffe,Spencer Wilding,Daniel Mays,Paul McGuigan,Drama|Horror|Sci-Fi|Thriller,victor frankenste,Daniel Radcliffe Spencer Wilding Daniel Mays Paul McGuigan Drama|Horror|Sci-Fi|Thriller
F. Murray Abraham,Rob Brown,Michael Nouri,Gus Van Sant,Drama,finding forrest,F. Murray Abraham Rob Brown Michael Nouri Gus Van Sant Drama
Steve Buscemi,Viggo Mortensen,Elizabeth Perkins,Betty Thomas,Comedy|Drama,28 da,Steve Buscemi Viggo Mortensen Elizabeth Perkins Betty Thomas Comedy|Drama
Morgan Freeman,Jet Li,Bob Hoskins,Louis Leterrier,Action|Crime|Drama|Thriller,unleash,Morgan Freeman Jet Li Bob Hoskins Louis Leterrier Action|Crime|Drama|Thriller
Judith Chapman,Lillian Adams,Chelsea Bond,Roger Kumble,Comedy|Romance,the sweetest thi,Judith Chapman Lillian Adams Chelsea Bond Roger Kumble Comedy|Romance
Tom Cruise,Holly Hunter,Wilford Brimley,Sydney Pollack,Drama|Mystery|Thriller,the fi,Tom Cruise Holly Hunter Wilford Brimley Sydney Pollack Drama|Mystery|Thriller
Augustus Prew,Charlie Tahan,Valerie Tian,Burr Steers,Drama|Fantasy|Romance,charlie st. clo,Augustus Prew Charlie Tahan Valerie Tian Burr Steers Drama|Fantasy|Romance
Jason Statham,Tony Goldwyn,Mini Anden,Simon West,Action|Crime|Thriller,the mechan,Jason Statham Tony Goldwyn Mini Anden Simon West Action|Crime|Thriller
Channing Tatum,Dax Flame,Rob Riggle,Phil Lord,Action|Comedy|Crime,21 jump stre,Channing Tatum Dax Flame Rob Riggle Phil Lord Action|Comedy|Crime
Julia Roberts,Clarke Peters,Dylan Moran,Roger Michell,Comedy|Drama|Romance,notting hi,Julia Roberts Clarke Peters Dylan Moran Roger Michell Comedy|Drama|Romance
Imelda Staunton,Miranda Richardson,Julia Sawalha,Peter Lord,Adventure|Animation|Comedy|Drama|Family,chicken r,Imelda Staunton Miranda Richardson Julia Sawalha Peter Lord Adventure|Animation|Comedy|Drama|Family
Philip Seymour Hoffman,Masi Oka,Debra Messing,John Hamburg,Comedy|Romance,along came pol,Philip Seymour Hoffman Masi Oka Debra Messing John Hamburg Comedy|Romance
John Witherspoon,Eartha Kitt,Geoffrey Holder,Reginald Hudlin,Comedy|Drama|Romance,boomera,John Witherspoon Eartha Kitt Geoffrey Holder Reginald Hudlin Comedy|Drama|Romance
Michael Rapaport,William Xifaras,Demián Bichir,Paul Feig,Action|Comedy|Crime,the he,Michael Rapaport William Xifaras Demián Bichir Paul Feig Action|Comedy|Crime
Martin Landau,Richard Burton,Roddy McDowall,Joseph L. Mankiewicz,Biography|Drama|History|Romance,cleopat,Martin Landau Richard Burton Roddy McDowall Joseph L. Mankiewicz Biography|Drama|History|Romance
Salma Hayek,Reggie Lee,Charice,Frank Coraci,Action|Comedy|Sport,here comes the bo,Salma Hayek Reggie Lee Charice Frank Coraci Action|Comedy|Sport
Morgan Freeman,Adam Scott,Bruce Davison,Carl Franklin,Crime|Drama|Mystery|Thriller,high crim,Morgan Freeman Adam Scott Bruce Davison Carl Franklin Crime|Drama|Mystery|Thriller
Jeff Bridges,Austin Pendleton,Mimi Rogers,Barbra Streisand,Comedy|Drama|Romance,the mirror has two fac,Jeff Bridges Austin Pendleton Mimi Rogers Barbra Streisand Comedy|Drama|Romance
Debra Messing,Will Patton,David Eigenberg,Mark Pellington,Drama|Horror|Mystery|Thriller,the mothman propheci,Debra Messing Will Patton David Eigenberg Mark Pellington Drama|Horror|Mystery|Thriller
Bono,Elton John,Slash,Larry Charles,Comedy,brü,Bono Elton John Slash Larry Charles Comedy
Robert Davi,Talisa Soto,Anthony Zerbe,John Glen,Action|Adventure|Thriller,licence to ki,Robert Davi Talisa Soto Anthony Zerbe John Glen Action|Adventure|Thriller
Gary Oldman,Billy Burke,Virginia Madsen,Catherine Hardwicke,Fantasy|Horror|Mystery|Thriller,red riding ho,Gary Oldman Billy Burke Virginia Madsen Catherine Hardwicke Fantasy|Horror|Mystery|Thriller
Robert De Niro,Charlize Theron,Kelsey Grammer,John Herzfeld,Action|Crime|Drama|Thriller,15 minut,Robert De Niro Charlize Theron Kelsey Grammer John Herzfeld Action|Crime|Drama|Thriller
Bob Hoskins,Fisher Stevens,Fiona Shaw,Annabel Jankel,Adventure|Comedy|Family|Fantasy|Sci-Fi,super mario bro,Bob Hoskins Fisher Stevens Fiona Shaw Annabel Jankel Adventure|Comedy|Family|Fantasy|Sci-Fi
Nicolas Cage,Jeremy Crutchley,Jared Burke,Andrew Niccol,Crime|Drama|Thriller,lord of w,Nicolas Cage Jeremy Crutchley Jared Burke Andrew Niccol Crime|Drama|Thriller
Jet Li,Tony Chiu Wai Leung,Maggie Cheung,Yimou Zhang,Action|Adventure|History,he,Jet Li Tony Chiu Wai Leung Maggie Cheung Yimou Zhang Action|Adventure|History
Fisher Stevens,Debbie Reynolds,Patrick Fischler,Julie Anne Robinson,Action|Comedy|Crime|Romance|Thriller,one for the mon,Fisher Stevens Debbie Reynolds Patrick Fischler Julie Anne Robinson Action|Comedy|Crime|Romance|Thriller
James Franco,Randall Park,Anders Holm,Evan Goldberg,Comedy,the intervi,James Franco Randall Park Anders Holm Evan Goldberg Comedy
Tony Cox,Dong-gun Jang,Jed Brophy,Sngmoo Lee,Action|Fantasy|Western,the warrior's w,Tony Cox Dong-gun Jang Jed Brophy Sngmoo Lee Action|Fantasy|Western
Tim Conway,Gavin MacLeod,Bob Hastings,uknown,Comedy|War,mchale's navy          ,Tim Conway Gavin MacLeod Bob Hastings uknown Comedy|War
Omar Sy,Dany Boon,André Dussollier,Jean-Pierre Jeunet,Action|Comedy|Crime,micma,Omar Sy Dany Boon André Dussollier Jean-Pierre Jeunet Action|Comedy|Crime
Mekhi Phifer,Omar Benson Miller,Evan Jones,Curtis Hanson,Drama|Music,8 mi,Mekhi Phifer Omar Benson Miller Evan Jones Curtis Hanson Drama|Music
Jamel Debbouze,Youssef Hajdi,Mélissa Theuriau,Jamel Debbouze,Adventure|Animation|Comedy|Family,animal kingdom: let's go a,Jamel Debbouze Youssef Hajdi Mélissa Theuriau Jamel Debbouze Adventure|Animation|Comedy|Family
Heath Ledger,Rufus Sewell,Bérénice Bejo,Brian Helgeland,Action|Adventure|Romance,a knight's ta,Heath Ledger Rufus Sewell Bérénice Bejo Brian Helgeland Action|Adventure|Romance
Julian Sands,Lee Evans,Anthony Chau-Sang Wong,Gordon Chan,Action|Comedy|Fantasy,the medalli,Julian Sands Lee Evans Anthony Chau-Sang Wong Gordon Chan Action|Comedy|Fantasy
Bruce Willis,Haley Joel Osment,Olivia Williams,M. Night Shyamalan,Drama|Mystery|Thriller,the sixth sen,Bruce Willis Haley Joel Osment Olivia Williams M. Night Shyamalan Drama|Mystery|Thriller
Robert Clohessy,Mandy Gonzalez,J. Smith-Cameron,Asger Leth,Action|Crime|Thriller,man on a led,Robert Clohessy Mandy Gonzalez J. Smith-Cameron Asger Leth Action|Crime|Thriller
Joel McHale,Kevin Pollak,JoBeth Williams,David Frankel,Comedy,the big ye,Joel McHale Kevin Pollak JoBeth Williams David Frankel Comedy
Martin Kove,William Zabka,William Bassett,John G. Avildsen,Action|Drama|Family|Sport,the karate k,Martin Kove William Zabka William Bassett John G. Avildsen Action|Drama|Family|Sport
Jennifer Lawrence,Christian Bale,Bradley Cooper,David O. Russell,Crime|Drama,american hust,Jennifer Lawrence Christian Bale Bradley Cooper David O. Russell Crime|Drama
Ryan Reynolds,Denis O'Hare,Craig T. Nelson,Anne Fletcher,Comedy|Drama|Romance,the propos,Ryan Reynolds Denis O'Hare Craig T. Nelson Anne Fletcher Comedy|Drama|Romance
Bruce Greenwood,Annabeth Gish,Bruce Campbell,Bruce Beresford,Crime|Mystery|Thriller,double jeopar,Bruce Greenwood Annabeth Gish Bruce Campbell Bruce Beresford Crime|Mystery|Thriller
Lea Thompson,Jeffrey Weissman,Thomas F. Wilson,Robert Zemeckis,Adventure|Comedy|Sci-Fi,back to the future part ,Lea Thompson Jeffrey Weissman Thomas F. Wilson Robert Zemeckis Adventure|Comedy|Sci-Fi
Scarlett Johansson,Morgan Freeman,Amr Waked,Luc Besson,Action|Sci-Fi|Thriller,lu,Scarlett Johansson Morgan Freeman Amr Waked Luc Besson Action|Sci-Fi|Thriller
Jennifer Ehle,Luke Grimes,Callum Rennie,Sam Taylor-Johnson,Drama|Romance,fifty shades of gr,Jennifer Ehle Luke Grimes Callum Rennie Sam Taylor-Johnson Drama|Romance
Sylvester Stallone,Salma Hayek,Alexa PenaVega,Robert Rodriguez,Action|Adventure|Comedy|Family|Sci-Fi,spy kids 3-d: game ov,Sylvester Stallone Salma Hayek Alexa PenaVega Robert Rodriguez Action|Adventure|Comedy|Family|Sci-Fi
Kevin Spacey,Matthew McConaughey,Oliver Platt,Joel Schumacher,Crime|Drama|Thriller,a time to ki,Kevin Spacey Matthew McConaughey Oliver Platt Joel Schumacher Crime|Drama|Thriller
Tom Welling,Alyson Stoner,Bonnie Hunt,Shawn Levy,Comedy|Family,cheaper by the doz,Tom Welling Alyson Stoner Bonnie Hunt Shawn Levy Comedy|Family
Jerry Ferrara,Scott Elrod,Dan Bilzerian,Peter Berg,Action|Biography|Drama|Thriller|War,lone surviv,Jerry Ferrara Scott Elrod Dan Bilzerian Peter Berg Action|Biography|Drama|Thriller|War
Tom Hanks,Lori Petty,Rosie O'Donnell,Penny Marshall,Comedy|Drama|Sport,a league of their o,Tom Hanks Lori Petty Rosie O'Donnell Penny Marshall Comedy|Drama|Sport
Javier Botet,Frances O'Connor,Robin Atkin Downes,James Wan,Horror|Mystery|Thriller,the conjuring,Javier Botet Frances O'Connor Robin Atkin Downes James Wan Horror|Mystery|Thriller
Andrew Garfield,Dustin Fitzsimons,Marcella Lentz-Pope,David Fincher,Biography|Drama,the social netwo,Andrew Garfield Dustin Fitzsimons Marcella Lentz-Pope David Fincher Biography|Drama
Carmen Perez,Sabrina Revelle,Sachiko Ishida,Ken Kwapis,Comedy|Drama|Romance,he's just not that into y,Carmen Perez Sabrina Revelle Sachiko Ishida Ken Kwapis Comedy|Drama|Romance
Beau Mirchoff,Carmen Electra,Regina Hall,David Zucker,Comedy,scary movie,Beau Mirchoff Carmen Electra Regina Hall David Zucker Comedy
Kelly Rutherford,Roger Jackson,Nancy O'Dell,Wes Craven,Horror|Mystery,scream,Kelly Rutherford Roger Jackson Nancy O'Dell Wes Craven Horror|Mystery
Lea Thompson,Jeffrey Weissman,Thomas F. Wilson,Robert Zemeckis,Adventure|Comedy|Sci-Fi|Western,back to the future part i,Lea Thompson Jeffrey Weissman Thomas F. Wilson Robert Zemeckis Adventure|Comedy|Sci-Fi|Western
Will Ferrell,Alison Brie,Craig T. Nelson,Etan Cohen,Comedy|Crime,get ha,Will Ferrell Alison Brie Craig T. Nelson Etan Cohen Comedy|Crime
Keanu Reeves,Anthony Hopkins,Gary Oldman,Francis Ford Coppola,Fantasy|Horror|Romance,bram stoker's dracu,Keanu Reeves Anthony Hopkins Gary Oldman Francis Ford Coppola Fantasy|Horror|Romance
Meryl Streep,Mary Lynn Rajskub,Vanessa Ferlito,Nora Ephron,Biography|Drama|Romance,julie & jul,Meryl Streep Mary Lynn Rajskub Vanessa Ferlito Nora Ephron Biography|Drama|Romance
Harrison Ford,Christopher Meloni,Nicole Beharie,Brian Helgeland,Biography|Drama|Sport,,Harrison Ford Christopher Meloni Nicole Beharie Brian Helgeland Biography|Drama|Sport
Philip Seymour Hoffman,Matt Damon,Jack Davenport,Anthony Minghella,Crime|Drama|Thriller,the talented mr. ripl,Philip Seymour Hoffman Matt Damon Jack Davenport Anthony Minghella Crime|Drama|Thriller
Bill Murray,Kathleen Turner,Rob Riggle,Bobby Farrelly,Comedy,dumb and dumber ,Bill Murray Kathleen Turner Rob Riggle Bobby Farrelly Comedy
Paul Walker,Bruce Greenwood,Wendy Crewson,Frank Marshall,Adventure|Drama|Family,eight bel,Paul Walker Bruce Greenwood Wendy Crewson Frank Marshall Adventure|Drama|Family
Robert De Niro,Anne Hathaway,Rene Russo,Nancy Meyers,Comedy|Drama,the inte,Robert De Niro Anne Hathaway Rene Russo Nancy Meyers Comedy|Drama
Olivia Munn,Nadine Velazquez,Bruce McGill,Tim Story,Action|Comedy,ride along,Olivia Munn Nadine Velazquez Bruce McGill Tim Story Action|Comedy
Wes Studi,Terry Kinney,Eric Schweig,Michael Mann,Action|Adventure|Drama|Romance|War,the last of the mohica,Wes Studi Terry Kinney Eric Schweig Michael Mann Action|Adventure|Drama|Romance|War
Bokeem Woodbine,Curtis Armstrong,Harry Lennix,Taylor Hackford,Biography|Drama|Music,r,Bokeem Woodbine Curtis Armstrong Harry Lennix Taylor Hackford Biography|Drama|Music
Rosario Dawson,Powers Boothe,Jason Douglas,Frank Miller,Crime|Thriller,sin ci,Rosario Dawson Powers Boothe Jason Douglas Frank Miller Crime|Thriller
Dennis Quaid,Edgar Ramírez,William Hurt,Pete Travis,Crime|Drama|Mystery|Thriller,vantage poi,Dennis Quaid Edgar Ramírez William Hurt Pete Travis Crime|Drama|Mystery|Thriller
J.K. Simmons,Jon Favreau,Jane Curtin,John Hamburg,Comedy|Romance,"i love you, m",J.K. Simmons Jon Favreau Jane Curtin John Hamburg Comedy|Romance
Jason Alexander,Bruce McGill,Susan Ward,Bobby Farrelly,Comedy|Drama|Fantasy|Romance,shallow h,Jason Alexander Bruce McGill Susan Ward Bobby Farrelly Comedy|Drama|Fantasy|Romance
Sally Kirkland,Jay O. Sanders,Cheryl Penland,Oliver Stone,Drama|History|Thriller,j,Sally Kirkland Jay O. Sanders Cheryl Penland Oliver Stone Drama|History|Thriller
Chloë Grace Moretz,Nia Long,Marisol Nichols,John Whitesell,Comedy|Crime,big momma's house,Chloë Grace Moretz Nia Long Marisol Nichols John Whitesell Comedy|Crime
J.K. Simmons,Brad Pitt,Julia Roberts,Gore Verbinski,Adventure|Comedy|Crime|Romance,the mexic,J.K. Simmons Brad Pitt Julia Roberts Gore Verbinski Adventure|Comedy|Crime|Romance
Finn Wittrock,Jack O'Connell,Alex Russell,Angelina Jolie Pitt,Biography|Drama|Sport|War,unbrok,Finn Wittrock Jack O'Connell Alex Russell Angelina Jolie Pitt Biography|Drama|Sport|War
Matthew Perry,Hunter Parrish,Thomas Lennon,Burr Steers,Comedy|Drama|Family|Fantasy|Romance,17 aga,Matthew Perry Hunter Parrish Thomas Lennon Burr Steers Comedy|Drama|Family|Fantasy|Romance
Don Johnson,Kate Upton,David Thornton,Nick Cassavetes,Comedy|Romance,the other wom,Don Johnson Kate Upton David Thornton Nick Cassavetes Comedy|Romance
Krista Allen,Andrew Fiscella,Shantel VanSanten,David R. Ellis,Horror,the final destinati,Krista Allen Andrew Fiscella Shantel VanSanten David R. Ellis Horror
Tom Hanks,Mark Rylance,Amy Ryan,Steven Spielberg,Drama|History|Thriller,bridge of spi,Tom Hanks Mark Rylance Amy Ryan Steven Spielberg Drama|History|Thriller
Joaquim de Almeida,David Keith,Sam Jaeger,John Moore,Action|Drama|Thriller|War,behind enemy lin,Joaquim de Almeida David Keith Sam Jaeger John Moore Action|Drama|Thriller|War
Pink,Mario Lopez,Lino Facioli,Nicholas Stoller,Comedy|Music,get him to the gre,Pink Mario Lopez Lino Facioli Nicholas Stoller Comedy|Music
Lisa Ann Walter,Nick Cannon,Omar Benson Miller,Peter Chelsom,Comedy|Drama|Romance,shall we dan,Lisa Ann Walter Nick Cannon Omar Benson Miller Peter Chelsom Comedy|Drama|Romance
Kirsten Dunst,Denis Leary,Robert Picardo,Joe Dante,Action|Adventure|Comedy|Family|Sci-Fi,small soldie,Kirsten Dunst Denis Leary Robert Picardo Joe Dante Action|Adventure|Comedy|Family|Sci-Fi
Michael Jai White,Frank Welker,Miko Hughes,Mark A.Z. Dippé,Action|Horror,spa,Michael Jai White Frank Welker Miko Hughes Mark A.Z. Dippé Action|Horror
Henry Cavill,James Frain,Michael Wincott,Kevin Reynolds,Action|Adventure|Drama|Romance|Thriller,the count of monte cris,Henry Cavill James Frain Michael Wincott Kevin Reynolds Action|Adventure|Drama|Romance|Thriller
Matthew McConaughey,Margarita Levieva,Frances Fisher,Brad Furman,Crime|Drama|Thriller,the lincoln lawy,Matthew McConaughey Margarita Levieva Frances Fisher Brad Furman Crime|Drama|Thriller
Liam Neeson,Frank Langella,Aidan Quinn,Jaume Collet-Serra,Action|Mystery|Thriller,unkno,Liam Neeson Frank Langella Aidan Quinn Jaume Collet-Serra Action|Mystery|Thriller
Christian Bale,Hugh Jackman,Scarlett Johansson,Christopher Nolan,Drama|Mystery|Sci-Fi|Thriller,the presti,Christian Bale Hugh Jackman Scarlett Johansson Christopher Nolan Drama|Mystery|Sci-Fi|Thriller
Kevin Spacey,Christoph Waltz,Lindsay Sloane,Sean Anders,Comedy|Crime,horrible bosses,Kevin Spacey Christoph Waltz Lindsay Sloane Sean Anders Comedy|Crime
Brendan Fraser,Paul Scheer,Jonathan Morgan Heit,Cal Brunker,Adventure|Animation|Comedy|Family|Sci-Fi,escape from planet ear,Brendan Fraser Paul Scheer Jonathan Morgan Heit Cal Brunker Adventure|Animation|Comedy|Family|Sci-Fi
Rudy Youngblood,Dalia Hernández,Jonathan Brewer,Mel Gibson,Action|Adventure|Drama|Thriller,apocalyp,Rudy Youngblood Dalia Hernández Jonathan Brewer Mel Gibson Action|Adventure|Drama|Thriller
Joe Don Baker,Desmond Llewelyn,Art Malik,John Glen,Action|Adventure|Thriller,the living dayligh,Joe Don Baker Desmond Llewelyn Art Malik John Glen Action|Adventure|Thriller
Topher Grace,Alice Braga,Derek Mears,Nimród Antal,Action|Adventure|Sci-Fi|Thriller,predato,Topher Grace Alice Braga Derek Mears Nimród Antal Action|Adventure|Sci-Fi|Thriller
Brian Dennehy,Debra Winger,Roscoe Lee Browne,Ivan Reitman,Comedy|Crime|Romance,legal eagl,Brian Dennehy Debra Winger Roscoe Lee Browne Ivan Reitman Comedy|Crime|Romance
Johnny Depp,Charles S. Dutton,Timothy Hutton,David Koepp,Mystery|Thriller,secret wind,Johnny Depp Charles S. Dutton Timothy Hutton David Koepp Mystery|Thriller
Keanu Reeves,Dylan Walsh,Ebon Moss-Bachrach,Alejandro Agresti,Drama|Fantasy|Romance,the lake hou,Keanu Reeves Dylan Walsh Ebon Moss-Bachrach Alejandro Agresti Drama|Fantasy|Romance
Gena Rowlands,Deneen Tyler,Joy Bryant,Iain Softley,Horror|Mystery|Thriller,the skeleton k,Gena Rowlands Deneen Tyler Joy Bryant Iain Softley Horror|Mystery|Thriller
Jennifer Garner,Odeya Rush,Common,Peter Hedges,Comedy|Drama|Family|Fantasy,the odd life of timothy gre,Jennifer Garner Odeya Rush Common Peter Hedges Comedy|Drama|Family|Fantasy
Busy Philipps,Beau Garrett,Kevin Sussman,Paul Weiland,Comedy|Romance,made of hon,Busy Philipps Beau Garrett Kevin Sussman Paul Weiland Comedy|Romance
Johnny Cannizzaro,Steve Schirripa,Scott Vance,Clint Eastwood,Biography|Drama|Music|Musical,jersey bo,Johnny Cannizzaro Steve Schirripa Scott Vance Clint Eastwood Biography|Drama|Music|Musical
Matt Damon,Dean Stockwell,Virginia Madsen,Francis Ford Coppola,Crime|Drama|Thriller,the rainmak,Matt Damon Dean Stockwell Virginia Madsen Francis Ford Coppola Crime|Drama|Thriller
Robert Downey Jr.,Charles S. Dutton,Bernard Hill,Mathieu Kassovitz,Horror|Mystery|Thriller,gothi,Robert Downey Jr. Charles S. Dutton Bernard Hill Mathieu Kassovitz Horror|Mystery|Thriller
Anthony Hopkins,Morgan Freeman,Matthew McConaughey,Steven Spielberg,Drama|History,amist,Anthony Hopkins Morgan Freeman Matthew McConaughey Steven Spielberg Drama|History
Lorraine Bracco,José Wilker,Sean Connery,John McTiernan,Adventure|Drama|Romance,medicine m,Lorraine Bracco José Wilker Sean Connery John McTiernan Adventure|Drama|Romance
Sam Trammell,Johnny Lewis,Ian Whyte,Colin Strause,Action|Horror|Sci-Fi|Thriller,aliens vs. predator: requi,Sam Trammell Johnny Lewis Ian Whyte Colin Strause Action|Horror|Sci-Fi|Thriller
Macaulay Culkin,John Larroquette,Jonathan Hyde,Donald Petrie,Comedy|Family,ri¢hie ri,Macaulay Culkin John Larroquette Jonathan Hyde Donald Petrie Comedy|Family
J.K. Simmons,Sam Trammell,Elaine Stritch,Joan Chen,Drama|Romance,autumn in new yo,J.K. Simmons Sam Trammell Elaine Stritch Joan Chen Drama|Romance
Brad Garrett,Scott Porter,Haley Bennett,Marc Lawrence,Comedy|Music|Romance,music and lyri,Brad Garrett Scott Porter Haley Bennett Marc Lawrence Comedy|Music|Romance
Bobby Lee,Nelson Ascencio,Jeremy Owen,Greg Mottola,Adventure|Comedy|Sci-Fi,pa,Bobby Lee Nelson Ascencio Jeremy Owen Greg Mottola Adventure|Comedy|Sci-Fi
Miriam Margolyes,Tom Virtue,Julene Renee,Anne Fletcher,Comedy|Drama,the guilt tr,Miriam Margolyes Tom Virtue Julene Renee Anne Fletcher Comedy|Drama
Alison Brie,Aimee Teegarden,Shenae Grimes-Beech,Wes Craven,Horror|Mystery,scream,Alison Brie Aimee Teegarden Shenae Grimes-Beech Wes Craven Horror|Mystery
Nicolas Cage,Chris Bauer,Anthony Heald,Joel Schumacher,Mystery|Thriller,8,Nicolas Cage Chris Bauer Anthony Heald Joel Schumacher Mystery|Thriller
Michael Wincott,Kevin Dillon,Kathleen Quinlan,Oliver Stone,Biography|Drama|Music|Musical,the doo,Michael Wincott Kevin Dillon Kathleen Quinlan Oliver Stone Biography|Drama|Music|Musical
James Wilcox,Randall Park,Nat Faxon,Jake Kasdan,Comedy,sex ta,James Wilcox Randall Park Nat Faxon Jake Kasdan Comedy
Adam Arkin,Celia Weston,Jesse James,Diane Keaton,Comedy|Drama,hanging ,Adam Arkin Celia Weston Jesse James Diane Keaton Comedy|Drama
Emma Bell,Jacqueline MacInnes Wood,Courtney B. Vance,Steven Quale,Horror,final destination,Emma Bell Jacqueline MacInnes Wood Courtney B. Vance Steven Quale Horror
Jeanne Tripplehorn,Burt Young,Vincent Pastore,Kelly Makin,Comedy|Crime|Romance,mickey blue ey,Jeanne Tripplehorn Burt Young Vincent Pastore Kelly Makin Comedy|Crime|Romance
Kevin Spacey,Haley Joel Osment,Angie Dickinson,Mimi Leder,Drama,pay it forwa,Kevin Spacey Haley Joel Osment Angie Dickinson Mimi Leder Drama
Jimmy Fallon,KaDee Strickland,Ione Skye,Bobby Farrelly,Comedy|Drama|Romance|Sport,fever pit,Jimmy Fallon KaDee Strickland Ione Skye Bobby Farrelly Comedy|Drama|Romance|Sport
Bruce Dinsmore,Melissa Altro,Daniel Brochu,uknown,Animation|Comedy|Family,arthur          ,Bruce Dinsmore Melissa Altro Daniel Brochu uknown Animation|Comedy|Family
Lisa Ann Walter,Shaun Weiss,Matt Walsh,Steven Brill,Comedy|Drama,drillbit tayl,Lisa Ann Walter Shaun Weiss Matt Walsh Steven Brill Comedy|Drama
Liam Neeson,Charlize Theron,Seth MacFarlane,Seth MacFarlane,Comedy|Western,a million ways to die in the we,Liam Neeson Charlize Theron Seth MacFarlane Seth MacFarlane Comedy|Western
Jonathan Winters,Peter Boyle,John Kapelos,Russell Mulcahy,Action|Adventure|Crime|Fantasy|Mystery|Thriller,the shad,Jonathan Winters Peter Boyle John Kapelos Russell Mulcahy Action|Adventure|Crime|Fantasy|Mystery|Thriller
Tom Hanks,Thomas Horn,Stephen Henderson,Stephen Daldry,Adventure|Drama|Mystery,extremely loud & incredibly clo,Tom Hanks Thomas Horn Stephen Henderson Stephen Daldry Adventure|Drama|Mystery
Noah Bean,Patti D'Arbanville,Vanessa Aspillaga,Roger Michell,Comedy|Drama|Romance,morning glo,Noah Bean Patti D'Arbanville Vanessa Aspillaga Roger Michell Comedy|Drama|Romance
50 Cent,Bill Duke,Marc John Jefferies,Jim Sheridan,Biography|Crime|Drama|Music,get rich or die tryi,50 Cent Bill Duke Marc John Jefferies Jim Sheridan Biography|Crime|Drama|Music
Michael Biehn,Cary-Hiroyuki Tagawa,Anne Archer,Christian Duguay,Action|Adventure|Crime|Thriller,the art of w,Michael Biehn Cary-Hiroyuki Tagawa Anne Archer Christian Duguay Action|Adventure|Crime|Thriller
Rosario Dawson,David Fine,Jesse L. Martin,Chris Columbus,Drama|Musical|Romance,re,Rosario Dawson David Fine Jesse L. Martin Chris Columbus Drama|Musical|Romance
Rufus Sewell,Jimmy Smits,Angela Bettis,Chuck Russell,Crime|Drama|Horror|Thriller,bless the chi,Rufus Sewell Jimmy Smits Angela Bettis Chuck Russell Crime|Drama|Horror|Thriller
Oliver Hudson,Valerie Perri,Carlease Burke,Sam Weisman,Comedy,the out-of-towne,Oliver Hudson Valerie Perri Carlease Burke Sam Weisman Comedy
Marlon Brando,Temuera Morrison,Marco Hofschneider,John Frankenheimer,Horror|Sci-Fi|Thriller,the island of dr. more,Marlon Brando Temuera Morrison Marco Hofschneider John Frankenheimer Horror|Sci-Fi|Thriller
Catherine Deneuve,Justin Chambers,Stephen Rea,Peter Hyams,Action|Adventure|Romance,the muskete,Catherine Deneuve Justin Chambers Stephen Rea Peter Hyams Action|Adventure|Romance
Natalie Portman,Scarlett Johansson,Benedict Cumberbatch,Justin Chadwick,Biography|Drama|History|Romance,the other boleyn gi,Natalie Portman Scarlett Johansson Benedict Cumberbatch Justin Chadwick Biography|Drama|History|Romance
Keanu Reeves,Charlize Theron,Frank Langella,Pat O'Connor,Drama|Romance,sweet novemb,Keanu Reeves Charlize Theron Frank Langella Pat O'Connor Drama|Romance
Stephen Rea,Andrea Frankle,William Ragsdale,Stephen Hopkins,Horror|Thriller,the reapi,Stephen Rea Andrea Frankle William Ragsdale Stephen Hopkins Horror|Thriller
Robert De Niro,David Carradine,David Proval,Martin Scorsese,Crime|Drama|Romance|Thriller,mean stree,Robert De Niro David Carradine David Proval Martin Scorsese Crime|Drama|Romance|Thriller
Ed Begley Jr.,Cliff Robertson,Lillo Brancato,Penny Marshall,Comedy|Drama,renaissance m,Ed Begley Jr. Cliff Robertson Lillo Brancato Penny Marshall Comedy|Drama
Jordi Mollà,Callum Blue,Jesse Borrego,Olivier Megaton,Action|Crime|Drama|Thriller,colombia,Jordi Mollà Callum Blue Jesse Borrego Olivier Megaton Action|Crime|Drama|Thriller
Gary Oldman,Jaleel White,Eric Idle,Frederik Du Chau,Adventure|Animation|Comedy|Drama|Family|Fantasy|Musical,the magic sword: quest for camel,Gary Oldman Jaleel White Eric Idle Frederik Du Chau Adventure|Animation|Comedy|Drama|Family|Fantasy|Musical
Robert De Niro,James Franco,John Doman,Michael Caton-Jones,Crime|Drama|Mystery|Thriller,city by the s,Robert De Niro James Franco John Doman Michael Caton-Jones Crime|Drama|Mystery|Thriller
Mira Sorvino,Nathan Lane,Steven Weber,Irwin Winkler,Drama|Romance,at first sig,Mira Sorvino Nathan Lane Steven Weber Irwin Winkler Drama|Romance
Dane Cook,Jay Hernandez,Christina Milian,Joseph Kahn,Action|Comedy|Crime,torq,Dane Cook Jay Hernandez Christina Milian Joseph Kahn Action|Comedy|Crime
Al Pacino,Martin Landau,Bridget Fonda,Harold Becker,Drama|Thriller,city ha,Al Pacino Martin Landau Bridget Fonda Harold Becker Drama|Thriller
Bobbie Phillips,Elizabeth Berkley,Robert Davi,Paul Verhoeven,Drama,showgir,Bobbie Phillips Elizabeth Berkley Robert Davi Paul Verhoeven Drama
